{
  "schema_version": "1.0.0",
  "record_type": "research_session",
  "id": "2026-06-21-senolytics-coverage-repair",
  "name": "Senolytics coverage repair pass",
  "mode": "coverage_repair",
  "started_at": "2026-06-21T17:30:00Z",
  "completed_at": "2026-06-21T18:50:00Z",
  "scope": {
    "question": "Can the senolytics track be expanded from a scaffold into an auditable evidence slice across preclinical, human, review, and trial-watch evidence?",
    "hallmark_ids": [
      "cellular_senescence",
      "chronic_inflammation"
    ],
    "track_ids": [
      "senolytics"
    ],
    "intervention_ids": [
      "dasatinib-quercetin",
      "fisetin"
    ]
  },
  "selected_via": "explicit_track",
  "outcome": "candidate_change_submitted",
  "summary": "Added verified PubMed and ClinicalTrials.gov source records, study records, finding records, outcome/result records, risk-of-bias records, eligibility decisions, and a new coverage assessment for the senolytics track. Claims were kept conservative pending endpoint-level extraction and supervisor-agent review.",
  "candidate_change_id": "senolytics-coverage-repair-2026-06-21",
  "next_recommended_mode": "extraction_refresh",
  "search_log": [
    {
      "source_name": "PubMed ESummary",
      "query": "PMID metadata check for 29988130, 31542391, 36857968, 38956196, 40010154, 32686219",
      "checked_at": "2026-06-21T17:45:00Z",
      "url": "https://eutils.ncbi.nlm.nih.gov/entrez/eutils/esummary.fcgi?db=pubmed&id=29988130,31542391,36857968,38956196,40010154,32686219&retmode=json",
      "summary": "Verified article titles, venues, publication dates, DOIs, PMIDs, and PMCID availability for the selected senolytics sources."
    },
    {
      "source_name": "ClinicalTrials.gov API v2",
      "query": "NCT metadata check for active or relevant senolytics trials",
      "checked_at": "2026-06-21T18:00:00Z",
      "url": "https://clinicaltrials.gov/api/v2/studies/NCT06133634",
      "summary": "Verified active trial-watch status and no posted results for NCT06133634 and checked registry metadata for other D+Q and fisetin trials."
    },
    {
      "source_name": "ClinicalTrials.gov API v2",
      "query": "NCT04685590",
      "checked_at": "2026-06-21T18:05:00Z",
      "url": "https://clinicaltrials.gov/api/v2/studies/NCT04685590",
      "summary": "Verified SToMP-AD active-not-recruiting status, phase 2 classification, estimated enrollment, and no posted results."
    }
  ],
  "excluded_sources": [
    {
      "reference": "NCT03430037",
      "title": "Alleviation by Fisetin of Frailty, Inflammation, and Related Measures in Older Women",
      "url": "https://clinicaltrials.gov/study/NCT03430037",
      "decision": "deferred",
      "reason": "Relevant trial-watch candidate, but deferred to a broader registry surveillance pass so this repair stayed focused on one complete vertical slice."
    },
    {
      "reference": "NCT03675724",
      "title": "Alleviation by Fisetin of Frailty, Inflammation, and Related Measures in Older Adults",
      "url": "https://clinicaltrials.gov/study/NCT03675724",
      "decision": "deferred",
      "reason": "Relevant trial-watch candidate, but deferred to the next registry surveillance pass."
    }
  ]
}
